[
  {
    "eventDate": "Sat, 3/18",
    "eventStartTime": "10:00 AM",
    "eventEndTime": "12:00 PM",
    "eventOrgShort": "27th",
    "eventOrgType": "LD",
    "eventTitle": "Coffee with Chair Lynda Foster",
    "eventLocationName": "B Sharp Coffee House",
    "eventLocationStreet": "706 Opera Alley",
    "eventLocationCity": "Tacoma",
    "eventLocationST": "WA",
    "eventLocationZip": "98402",
    "eventWeb": "https://www.facebook.com/events/393822487652566/",
    "eventFbId": "393822487652566",
    "eventDescription": "These are intended to space for anyone to show up and talk about anything on their mind"
  },
  {
    "eventDate": "Sat, 3/18",
    "eventStartTime": "2:00 PM",
    "eventEndTime": "4:00 PM",
    "eventOrgShort": "3rd",
    "eventOrgType": "CD",
    "eventTitle": "Local Party Politics 101",
    "eventLocationName": "Camas Public Library",
    "eventLocationStreet": "625 NE 4th Ave.",
    "eventLocationCity": "Camas",
    "eventLocationST": "WA",
    "eventLocationZip": "98607",
    "eventWeb": "https://www.facebook.com/events/706707589499205/",
    "eventFbId": "706707589499205",
    "eventDescription": "Learn how to get involved and organized politically with WA Dems Exec. Board member Justin Oberg"
  },
  {
    "eventDate": "Sat, 3/18",
    "eventStartTime": "4:00 PM",
    "eventEndTime": "9:00 PM",
    "eventOrgShort": "Pacific",
    "eventOrgType": "County",
    "eventTitle": "92nd Annual Crab Feed",
    "eventLocationName": "Willapa Harbor Community Building",
    "eventLocationStreet": "916 W. First Street",
    "eventLocationCity": "South Bend",
    "eventLocationST": "WA",
    "eventLocationZip": "98586",
    "eventWeb": "http://www.pacificcountydemocrats.com/annual-crab-feed.html",
    "eventFbId": "1846722112282287",
    "eventDescription": "4pm: Social Hour, 5pm: Dinner and Program.  Includes: Live Auction, Silent Auction, Raffle, Speakers, and Pacific County Democrat of the Year"
  }
]
