[
  {
    "eventDate": "Sat, 3/18",
    "eventStartTime": "10:00 AM",
    "eventEndTime": "12:00 PM",
    "eventOrgShort": "27th",
    "eventOrgType": "LD",
    "eventTitle": "Coffee with Chair Lynda Foster",
    "eventLocationName": "B Sharp Coffee House",
    "eventLocationStreet": "706 Opera Alley",
    "eventLocationCity": "Tacoma",
    "eventLocationST": "WA",
    "eventLocationZip": "98402",
    "eventWeb": "https://www.facebook.com/events/393822487652566/",
    "eventFbId": "393822487652566",
    "eventDescription": "These are intended to space for anyone to show up and talk about anything on their mind"
  },
  {
    "eventDate": "Sat, 4/22",
    "eventStartTime": "1:00 PM",
    "eventEndTime": "5:00 PM",
    "eventOrgShort": "WA",
    "eventOrgType": "State",
    "eventTitle": "WSDCC Meetings",
    "eventLocationName": "Walla Walla",
    "eventLocationStreet": "",
    "eventLocationCity": "Walla Walla",
    "eventLocationST": "WA",
    "eventLocationZip": "",
    "eventWeb": "",
    "eventDescription": "Washington State Democratic Central Committee (WSDCC) spring meetings in Walla Walla"
  },
  {
    "eventDate": "Sat, 4/29",
    "eventStartTime": "6:00 PM",
    "eventOrgShort": "NPI",
    "eventOrgType": "Ally",
    "eventTitle": "2017 Spring Fundraising Gala",
    "eventLocationName": "Mercer Island Community & Event Center",
    "eventLocationStreet": "8236 SE 24th St.",
    "eventLocationCity": "Mercer Island",
    "eventLocationST": "WA",
    "eventLocationZip": "98040",
    "eventWeb": "https://www.nwprogressive.org/gala/",
    "eventDescription": "Reception starts at 6 PM, main program at 7 PM.  Full dinner buffet with vegetarian choices; beer and wine available from cash bar"
  }  
]
